{
  "id": "004-i18n-language-selector",
  "title": "Add i18n Language Selector for Doc-Site",
  "status": "IN_PROGRESS",
  "priority": "High",
  "created": "2025-12-24T06:00:00Z",
  "updated": "2025-12-24T06:00:00Z",
  "assignee": "AI",
  "description": "Thêm chức năng chọn ngôn ngữ cho doc-site. Hỗ trợ 3 ngôn ngữ: English, Tiếng Việt, 中文（台灣）. Sử dụng Option B (full localized docs) - mỗi locale có bộ docs riêng tại data/locales/{locale}/docs/.",
  "acceptanceCriteria": [
    { "id": "ac-1", "text": "Language selector hiển thị trong header", "completed": true },
    { "id": "ac-2", "text": "Có 3 locales: en, vi, zh-TW", "completed": true },
    { "id": "ac-3", "text": "Chọn ngôn ngữ thay đổi navigation và docs", "completed": true },
    { "id": "ac-4", "text": "Locale được lưu vào localStorage", "completed": true },
    { "id": "ac-5", "text": "Fallback về canonical docs nếu locale docs không có", "completed": true },
    { "id": "ac-6", "text": "Code tuân thủ ES5 (không dùng ES6+)", "completed": true },
    { "id": "ac-7", "text": "Build script copy locales vào build-output", "completed": true }
  ],
  "subtasks": [
    { "id": "st-1", "text": "Tạo entity/common/i18n.js module", "completed": true },
    { "id": "st-2", "text": "Scaffold locales data (en, vi, zh-TW)", "completed": true },
    { "id": "st-3", "text": "Thêm language selector UI vào index.html", "completed": true },
    { "id": "st-4", "text": "Wire selector trong define.js", "completed": true },
    { "id": "st-5", "text": "Init i18n trong entity/index.js", "completed": true },
    { "id": "st-6", "text": "Fix ES6 code về ES5 (async, Promise.resolve)", "completed": true },
    { "id": "st-7", "text": "Update build scripts", "completed": true },
    { "id": "st-8", "text": "Test và QA", "completed": false }
  ],
  "tags": ["i18n", "doc-site", "feature", "localization"],
  "relatedFiles": [
    "entity/common/i18n.js",
    "entity/index.js",
    "projects/doc-site/www/index.html",
    "projects/doc-site/www/define.js",
    "projects/doc-site/data/locales/",
    "scripts/build_project.sh",
    "scripts/prepare_locales.sh"
  ],
  "notes": "Bug đã fix: script nesting trong index.html khiến page trống. ES6 violations đã sửa (async -> function, Promise.resolve removed).",
  "history": [
    { "timestamp": "2025-12-24T06:00:00Z", "action": "created", "status": "IN_PROGRESS", "note": "Task được tạo để hoàn chỉnh tính năng i18n" }
  ]
}
